Tool_name,Description,Location
Vacuum concentrators," Vacuum concentrators remove solvent or water from samples under reduced pressure. They are used for sample concentration, drying, or solvent removal in bioprocessing.",https://encrypted-tbn0.gstatic.com/images?q=tbn:ANd9GcRsGIzmDIoNRWsEH7YlO-6LY2nZ3unfZ9CMi6TAshjYDdOuqCA5ROQLJaTn5N2mQH0Zqys&usqp=CAU
Vacuum Pump, Equipment for creating a vacuum environment in fermentation vessels.,https://encrypted-tbn0.gstatic.com/images?q=tbn:ANd9GcS2nsqPiAoA6td03ZFNmMwkxWdyAQayKc1QgXCEBgI1W-XIXkBSYeV-8nm1FCLHjxHiZSM&usqp=CAU
Virus filtration systems,Virus filtration systems are specialized filters used to remove viruses from bioprocess streams. They ensure the safety and purity of biopharmaceutical products by effectively capturing and retaining viral particles.,https://agilitech.bio/wp-content/uploads/agilitech-virus-filtration-system-news-images.jpg
Viscometers," Viscometers measure the viscosity and flow properties of fluids in bioprocessing. They help characterize the rheological behavior of solutions, suspensions, or emulsions and ensure optimal process conditions.",https://www.labbulletin.com/design/csm_ViscoQC-300-03_52acda5471.jpg
X-ray diffraction systems,"X-ray diffraction systems analyze the crystal structure of biomolecules, providing valuable information about their conformation and interactions. They are used in structural biology and drug discovery research.",https://encrypted-tbn0.gstatic.com/images?q=tbn:ANd9GcQA7HgRTeR4zNfANZy4jo8C4WEc3nmnQW_cqg9a8h93MAOhwbKyaJlxi1WQUhA-du5U03E&usqp=CAU
Yogurt Maker,Appliance for incubating yogurt cultures.,https://kateris.org/wp-content/uploads/2019/01/pistolia-giaourtis-3.jpg
Adaptive Laboratory Evolution," The process involves continuous cultivation in the presence of selective pressure, such as increasing substrate concentrations or toxic compounds. Over time, microorganisms can acquire genetic changes that confer improved fitness, leading to enhanced product yields or tolerance to challenging process conditions..",https://systemsbiology.ucsd.edu/sites/systemsbiology.ucsd.edu/files/Attachments/for%20what%20we%20do/image001_0.png 
Affinity Chromatography:,"Affinity chromatography exploits the specific interactions between a biomolecule of interest and a complementary ligand immobilized on the stationary phase.The stationary phase can be designed to bind specifically to the target molecule, allowing other unwanted components to be washed away. Elution of the target molecule is achieved by using a competing ligand or changing the conditions to disrupt the specific interaction. Affinity chromatography is highly selective and can be used for the purification of proteins, enzymes, antibodies, and other biomolecules.",https://cdn1.sinobiological.com/styles/default/images/pdyimg/CRO/CRO_protein_info/uu19.png 
Air drying,"Air drying is a simple and cost-effective method of drying where the material is exposed to ambient air, allowing moisture to evaporate. This method is often used for low-value products or samples with low moisture content. However, air drying can be slow and may lead to the loss of volatile components or degradation of sensitive biomolecules.",https://techblog.ctgclean.com/wp-content/uploads/Hot-Air-Dryer-Schematic.jpg 
Anti-solvent Crystallization," Anti-solvent crystallization involves the addition of a non-solvent or an anti-solvent to the solution, causing a decrease in the solubility of the compound and promoting crystallization. The non-solvent reduces the solvent power of the original solution, leading to the precipitation of the solute as crystals. Anti-solvent crystallization is useful when the solute has low solubility in the anti-solvent or when selective precipitation of the solute is desired.",https://ars.els-cdn.com/content/image/1-s2.0-S0927776516305793-fx1.jpg 
Autoclaving,"Autoclaving is a widely used sterilization technique that utilizes high-pressure steam to achieve effective sterilization. The combination of high temperature and pressure effectively kills microorganisms, including bacteria, viruses, and spores. Autoclaves are widely available and can sterilize a wide range of equipment, media, and products. However, heat-sensitive materials may be prone to damage during autoclaving, and certain microorganisms or heat-resistant spores may require extended sterilization cycles or higher temperatures",https://microbeonline.com/wp-content/uploads/2019/10/types-of-Autoclave.jpg 
Batch and Continuous Crystallization,"Crystallization can be performed in batch mode, where a fixed volume of the solution is processed in a single vessel, or in continuous mode, where the solution is continuously fed into the crystallizer, and the crystals are continuously harvested. Continuous crystallization offers advantages such as improved control over crystal size and properties, higher productivity, and reduced batch-to-batch variability",https://static.cambridge.org/binary/version/id/urn:cambridge.org:id:binary:20190613072626419-0522:9781139026949:19618fig12_5.png?pub-status=live 
Chemical cell disruption,"Chemical disruption methods involve the use of chemical agents to disrupt cell membranes and release intracellular components. Detergents are often used in cell lysis buffers to solubilize the lipid membranes and disrupt the cells. Organic solvents can also be employed to disrupt cell membranes by dissolving the lipid bilayers and causing cell lysis. Osmotic shock involves subjecting cells to a sudden change in osmotic pressure, typically by rapidly alternating between hypotonic and hypertonic solutions. This osmotic stress leads to the rupture of the cell membranes and the release of intracellular contents",https://www.mdpi.com/micromachines/micromachines-08-00083/article_deploy/html/images/micromachines-08-00083-g001-550.jpg 
Chemical sterilization,"Autoclaving is a widely used sterilization technique that utilizes high-pressure steam to achieve effective sterilization. The combination of high temperature and pressure effectively kills microorganisms, including bacteria, viruses, and spores. Autoclaves are widely available and can sterilize a wide range of equipment, media, and products. However, heat-sensitive materials may be prone to damage during autoclaving, and certain microorganisms or heat-resistant spores may require extended sterilization cycles or higher temperatures",https://solutionpharmacy.in/wp-content/uploads/2021/07/Types-of-chemical-methods-of-sterilization.jpg 
Chiral Chromatography,"Chiral chromatography separates enantiomers (mirror image isomers) of molecules that possess chirality. It utilizes chiral stationary phases, which can be either based on modified polysaccharides or chiral small molecules. Chiral chromatography is crucial for the separation and analysis of enantiomers in pharmaceuticals, natural products, and other chiral compounds.",https://pubs.rsc.org/en/Content/Image/GA/B808881K 
Cooling Crystalization,"Cooling crystallization is a commonly used technique where the supersaturated solution is gradually cooled to induce crystallization. As the solution temperature decreases, the solute solubility decreases, leading to the formation of crystals. Cooling crystallization is relatively simple and widely applicable but may require careful control to avoid the formation of unwanted impurities or amorphous solids. It is often used for the purification and isolation of compounds from complex mixtures.",https://www.evatherm.com/img/contentbilder/cooling-crystallization-gross.gif 
Crossflow Filtration,"Crossflow filtration is a type of filtration where the liquid or solution flows parallel to the membrane surface. The crossflow creates shear forces that continually sweep away retained particles, preventing the formation of a dense filter cake and reducing fouling. Crossflow filtration is often used in applications where the feed solution contains high levels of suspended solids or when there is a need to concentrate or fractionate molecules without clogging the membrane.",https://www.kerafol.com/_wpframe_custom/gallery/files/wpf_sites_paragraphs_parts/b_rotation-filtrationjpg_1585643621.jpg 
Crystal Growth,"After nucleation, crystal growth takes place, where the crystal nuclei grow in size and develop into well-defined crystals. Crystal growth occurs as solute molecules from the supersaturated solution attach themselves to the crystal surface, leading to an increase in crystal size. The growth rate of crystals can be controlled by adjusting parameters such as temperature, solution composition, stirring rate, and the addition of growth modifiers. Proper control of crystal growth conditions is important to obtain crystals with desired size, shape, and purity.",https://media.springernature.com/lw685/springer-static/image/art%3A10.1038%2Fs41467-020-19882-8/MediaObjects/41467_2020_19882_Fig1_HTML.png 
Depth Filtration," The porous media provide a three-dimensional matrix with interconnected channels that trap particles as the liquid passes through. As the liquid flows through the depth filter, particles are captured by mechanisms such as adsorption, sieving, and entrapment within the matrix. Depth filtration is suitable for removing cells, biomass, and larger particles but may have limited efficiency for fine particulate matter.",https://www.genengnews.com/wp-content/uploads/2018/10/3M_Fig1A_B3828813815.jpg 
Differential Centrifugation,"Differential centrifugation is a common technique used to separate particles or components based on their size and density differences. The sample is subjected to successive rounds of centrifugation at increasing speeds or durations. Each round of centrifugation results in the sedimentation of particles or components of different sizes and densities, leading to their separation. After each centrifugation step, the supernatant is carefully removed, and the pellet containing the sedimented particles is retained for further processing.",https://microbiologynote.com/wp-content/uploads/2021/12/Differential-centrifugation-1-scaled.jpg 
Enzymatic cell disruption,"Enzymatic disruption relies on the use of enzymes to degrade the cell walls and facilitate cell lysis. Enzymes such as lysozyme, which targets the bacterial cell wall, or cellulases, which break down plant cell walls, are commonly employed. These enzymes weaken the structural integrity of the cell walls, making it easier to disrupt the cells and release their intracellular components.",https://ars.els-cdn.com/content/image/1-s2.0-S2211926417303752-fx1.jpg 
Evapouration Crystallization,"Evaporative crystallization involves the gradual removal of the solvent from the solution, either by heating or by reduced pressure, to induce crystallization. As the solvent evaporates, the solute concentration increases, surpassing its solubility limit, resulting in crystal formation. Evaporative crystallization is suitable for compounds with high solubilities and is commonly employed in industries where heat-sensitive materials need to be crystallized.
",https://media.geeksforgeeks.org/wp-content/uploads/20221110124308/CrystallizationProcess.png 
Fluidised bed dryong,"Fluidized bed drying involves suspending the material in a stream of hot air or gas, creating a fluidized bed. The hot air passes through the bed, evaporating the moisture from the material. The fluidized bed provides efficient heat and mass transfer, resulting in faster drying times. Fluidized bed drying is commonly used for granular materials, particles, and pellets in pharmaceutical and chemical industries.",https://ars.els-cdn.com/content/image/1-s2.0-S1364032116300314-gr1.jpg 
Freeze drying,"Freeze drying is a widely used drying technique in bioprocessing, especially for heat-sensitive and delicate materials such as proteins, vaccines, and pharmaceuticals. It involves freezing the material and then subjecting it to a vacuum to remove the frozen water through sublimation. Sublimation is the direct conversion of ice into vapor without passing through the liquid phase. Freeze drying helps to retain the structural integrity and biological activity of the dried product.",https://ars.els-cdn.com/content/image/3-s2.0-B9780123849472003287-f00328-02-9780123849472.jpg 
Gel Filtration Chromatography (Size Exclusion Chromatography)," Gel filtration chromatography separates molecules based on their size and molecular weight. It utilizes a porous stationary phase (gel beads) that allows smaller molecules to enter the pores, resulting in longer residence times, while larger molecules pass through the column more quickly. As a result, larger molecules elute earlier and are collected in the void volume, while smaller molecules elute later and are separated from the larger species. Gel filtration chromatography is often used for desalting, buffer exchange, and fractionation of biomolecules.",https://i.ytimg.com/vi/nIwwJ3H4_D4/hqdefault.jpg 
Genetic Engineering,"Genetic engineering techniques allow for targeted modifications of an organism's genome to introduce or enhance specific functionalities. Recombinant DNA technology enables the introduction of foreign genes or the modification of existing genes to enhance the production of a desired product. Genetic engineering tools include DNA cloning, gene knockout or disruption, gene overexpression, and site-directed mutagenesis.",https://www.researchgate.net/publication/360832515/figure/fig3/AS:11431281095602130@1667954016863/a-Basic-steps-of-genetic-engineering-In-step-1-a-gene-of-interest-consisting-of-a.png
Gradient Centrifugation,"Gradient centrifugation involves the use of density gradients to separate particles or components based on their buoyant densities. A density gradient medium, such as sucrose or cesium chloride, is prepared with a gradient of increasing or decreasing density. The sample is layered onto the top of the gradient and centrifuged. During centrifugation, particles or components migrate through the density gradient until they reach their buoyant density and form distinct bands or fractions. Gradient centrifugation is particularly useful for separating and purifying subcellular organelles, viruses, or nucleic acids.",https://www.beyonddiscovery.org/liquid-chromatography/images/7620_29_18-separation-mixtures-based-density.jpg 
HPLC (High-Performance Liquid Chromatography)," HPLC is a versatile chromatographic technique that employs high-pressure pumps to enhance the separation efficiency and speed. It can incorporate various chromatographic modes, including reversed phase, ion exchange, size exclusion, and affinity chromatography. HPLC is widely used for analytical and preparative purposes in bioprocessing, pharmaceutical analysis, and quality control.",https://chembam.files.wordpress.com/2017/02/hplc.png 
Hydrophobic Interaction Chromatography (HIC),"Hydrophobic interaction chromatography separates molecules based on their hydrophobicity or surface hydrophobic patches. The stationary phase contains hydrophobic groups, such as alkyl chains, which interact with hydrophobic regions of the biomolecules. Elution is achieved by decreasing the hydrophobic interaction, often by reducing the salt concentration or altering the pH. HIC is commonly used for the separation and purification of proteins, especially those with exposed hydrophobic patches",https://thechemistrynotes.com/wp-content/uploads/2023/02/Hydrophobic-interaction-chromatography-HIC.jpg 
Ion Exchange Chromatography,"Ion exchange chromatography separates molecules based on their charge differences. It utilizes a stationary phase containing charged groups that interact with oppositely charged molecules. An ion exchange column can be either anion exchange or cation exchange, depending on whether the stationary phase binds negatively or positively charged molecules, respectively. The bound molecules can be eluted by altering the pH or ionic strength of the mobile phase.  Ion exchange chromatography is commonly used for the separation and purification of proteins, nucleic acids, and other charged biomolecules",https://microbenotes.com/wp-content/uploads/2018/11/Ion-Exchange-Chromatography.jpg 
Isopycnic Centrifugation (Equilibrium Density Gradient Centrifugation),"Isopycnic centrifugation, also known as equilibrium density gradient centrifugation, is used to separate particles or components solely based on their density. A density gradient medium, such as cesium chloride or sucrose, is prepared with a continuous gradient of increasing density. The sample is layered onto the top of the gradient and centrifuged until equilibrium is reached. During centrifugation, particles migrate through the gradient until they reach a position where their density matches the surrounding density of the gradient. At equilibrium, particles float or sink in the density gradient, forming distinct bands or fractions. Isopycnic centrifugation is particularly useful for separating molecules with similar sizes but different densities, such as nucleic acids or lipoproteins.",https://ars.els-cdn.com/content/image/3-s2.0-B978012802823000002X-f02-03-9780128028230.jpg 
Mechanical cell disruption,"Mechanical disruption methods utilize physical forces to disrupt the cell walls and membranes. Homogenization is a widely used mechanical method where cells are mechanically sheared or disrupted using high-speed blades or rotating homogenizers. This process effectively breaks down the cell structure and releases the intracellular components. Sonication is another mechanical disruption technique that utilizes high-frequency sound waves. The sound waves create intense vibrations that disrupt the cells, leading to the release of their contents. Bead milling involves agitating cells in the presence of small beads, which mechanically rupture the cell walls and facilitate the extraction of intracellular components. High-pressure homogenization subjects cells to high-pressure forces, typically through a narrow aperture, which causes the cells to burst and release their contents.",https://www.mdpi.com/fermentation/fermentation-07-00036/article_deploy/html/images/fermentation-07-00036-g001.png 
Media Formulation," Components of growth media typically include carbon sources (e.g., glucose, glycerol), nitrogen sources (e.g., ammonium salts, amino acids), minerals, vitamins, and trace elements. Optimization of growth media involves determining the optimal concentration and ratio of each component to achieve desired growth and productivity.",https://media.springernature.com/lw685/springer-static/image/art%3A10.1186%2Fs43014-022-00098-w/MediaObjects/43014_2022_98_Figa_HTML.png 
Membrane Filtration," Membrane filters can be made of various materials, including cellulose, polymeric materials, or ceramic materials, depending on the specific application requirements. The pore size of the membrane determines the size of particles that can be effectively retained. Common types of membrane filtration include microfiltration (MF), ultrafiltration (UF), nanofiltration (NF), and reverse osmosis (RO), each with different pore size ranges and separation capabilities. Microfiltration is effective for removing larger particles and cells, while ultrafiltration and nanofiltration can separate smaller particles, macromolecules, and proteins. Reverse osmosis is employed for desalination and concentration of solutes by applying pressure to overcome osmotic pressure.",https://i0.wp.com/microbeonline.com/wp-content/uploads/2019/09/Membrane-filtration-technique.jpg?fit=678%2C876&ssl=1 
Metabolic Engineering,"Metabolic engineering involves manipulating the metabolic pathways of microorganisms to enhance the production of desired products or redirect metabolic flux for improved yields.This technique often includes altering the expression or activity of enzymes involved in the target product's biosynthetic pathway. Strategies may include increasing the availability of key precursors, knocking out competing pathways, or introducing novel pathways to maximize product formation.",https://filelist.tudelft.nl/TNW/Afdelingen/Biotechnology/Departments/Industrial%20Microbiology/Jean-Marc%20Daran/DBTL%20751x640.jpg 
Microwave drying,"Microwave drying utilizes microwave energy to generate heat within the material, promoting the evaporation of moisture. Microwave drying offers rapid and uniform drying and is suitable for drying materials with high water content. It is commonly used in food processing, pharmaceuticals, and agriculture for quick and efficient drying",https://ars.els-cdn.com/content/image/3-s2.0-B9780081005965210093-f21009-10-9780081005965.jpg 
Nucleation,"Nucleation is the initial step in the crystallization process, where solute molecules come together to form a stable crystal nucleus. Nucleation can occur through two mechanisms: primary nucleation and secondary nucleation. Primary nucleation involves the spontaneous formation of nuclei from the supersaturated solution, while secondary nucleation occurs when existing crystals act as templates for the formation of new crystals. Nucleation can be influenced by factors such as temperature, solute concentration, impurities, and the presence of nucleating agents.
",https://www.mdpi.com/crystals/crystals-12-00980/article_deploy/html/images/crystals-12-00980-g004.png 
Oven drying,Oven drying involves placing the material in an oven and applying heat to remove moisture. This method is simple and widely accessible but requires careful temperature control to avoid degradation or overheating of the material. Oven drying is commonly used for bulk drying of samples or materials with low moisture content,https://ikrorwxhqjrilj5q.ldycdn.com/cloud/lmBprKkmljSRrjplojjqio/01_bov_t30c_main.jpg 
Pre-filtration,"Pre-filtration steps utilize filters with larger pore sizes to remove larger particles and debris, protecting downstream filters from premature fouling.",https://www.mdimembrane.com/blog/wp-content/uploads/2018/07/ClariPro-GK-1-300x209.jpg 
Protein precipitation,"Protein precipitation is a specific application of precipitation techniques that aims to selectively precipitate proteins from a complex mixture. Various methods are employed for protein precipitation based on the specific properties of the proteins. Some common techniques include altering the pH of the solution, adding organic solvents, or using specific protein precipitants. For example, adjusting the pH to the isoelectric point of a protein can cause it to undergo precipitation due to the loss of net charge. Organic solvents such as trichloroacetic acid (TCA) or polyethylene glycol (PEG) can be used to selectively precipitate proteins based on their solubility in these solvents.",https://www.norlab.com/sites/default/files/Sample%20preparation%20using%20ISOLUTE%20PPT%2B.jpg 
Radiation sterilization,"Radiation sterilization utilizes ionizing radiation, such as gamma rays or electron beams, to achieve sterilization. These forms of radiation have sufficient energy to penetrate materials and damage the DNA of microorganisms, rendering them unable to replicate. Radiation sterilization is commonly used for the sterilization of disposable items, pharmaceuticals, and medical devices. It offers effective sterilization without the use of heat or chemicals. However, it requires specialized equipment and expertise to ensure appropriate dosages and proper shielding to protect operators and the surrounding environment",https://ars.els-cdn.com/content/image/3-s2.0-B9780128144213000142-f14-08-9780128144213.jpg 
Reverse Phase Chromatography (RPC),"Reverse phase chromatography is a type of liquid chromatography that separates molecules based on their hydrophobicity. The stationary phase is nonpolar, and the mobile phase is polar. Hydrophobic molecules interact more strongly with the stationary phase and elute later, while hydrophilic molecules elute earlier. Reverse phase chromatography is widely used in analytical and preparative applications for the separation and purification of hydrophobic compounds, such as lipids, peptides, and pharmaceuticals.",https://ars.els-cdn.com/content/image/3-s2.0-B9780444640468002755-f00275-04-9780444640468.jpg 
Salting out,"It involves the addition of salts, such as ammonium sulfate or sodium chloride, to the solution containing the biomolecules. The salts reduce the solubility of the biomolecules by disrupting their hydration shell and weakening their electrostatic interactions. As a result, the biomolecules aggregate and precipitate out of the solution. The choice of the salt concentration depends on the desired selectivity and precipitation efficiency.",https://ars.els-cdn.com/content/image/3-s2.0-B9780128197639000052-f05-09-9780128197639.jpg 
Screening and Isolation,"Screening involves the identification and selection of microorganisms from natural sources that possess the desired characteristics for a particular bioprocess. Environmental samples, such as soil, water, or plant material, can be screened for microorganisms that produce the desired product or exhibit specific metabolic capabilities. Screening techniques may include culture-based methods, molecular assays, or high-throughput screening approaches.",https://www.learninsta.com/wp-content/uploads/2021/04/Screening-of-Industrially-Important-Microorganism-img-1.png
Seed Crysrtalizastion,"Seed crystallization involves the addition of pre-formed crystals (seeds) into the supersaturated solution to induce crystal growth. Seeds act as templates for crystal growth, accelerating the process and ensuring the formation of crystals with desired properties. Seed crystallization allows for better control over crystal size, shape, and purity. The seed crystals can be generated from the same compound or similar compounds, and their introduction helps in obtaining a uniform and reproducible crystal product.",https://bitesizebio.com/wp-content/uploads/2022/01/Figure-4-web.jpg 
