Tool_name,Description,Location
 autoclave, Equipment for sterilizing fermentation vessels and equipment using steam.,https://tamilcrew.com/wp-content/uploads/2021/04/Industrial-Fermenter-Autoclave-Incubator.jpg
 autoclave, Equipment for sterilizing fermentation vessels and equipment using steam.,https://tamilcrew.com/wp-content/uploads/2021/04/Industrial-Fermenter-Autoclave-Incubator.jpg
3D bioprinters ,"3D bioprinters use additive manufacturing techniques to create three-dimensional structures or tissues using bioinks containing living cells. They enable tissue engineering, organ-on-a-chip systems, or regenerative medicine applications in bioprocessing.",https://www.genengnews.com/wp-content/uploads/2021/03/Supp_CellTherapy3DPrinting_Cellink_PrinterInAction-scaled-e1617206790847.jpg
Aeration System, System for providing oxygen to fermenting cultures.,https://www.thecompressedairblog.com/hubfs/Air%20Compressor%20Set-Up.png
Agar Plate,Culture medium used for microbial isolation and identification.,https://encrypted-tbn0.gstatic.com/images?q=tbn:ANd9GcS9zRrtQ5fz8bvgSg3qJoWVHgzgMJ7GBtzW_mKTk_g4IHKDJpO8yQobv_311CBa9fnQCas&usqp=CAU
Agar Plate,Culture medium used for microbial isolation and identification.,https://encrypted-tbn0.gstatic.com/images?q=tbn:ANd9GcS9zRrtQ5fz8bvgSg3qJoWVHgzgMJ7GBtzW_mKTk_g4IHKDJpO8yQobv_311CBa9fnQCas&usqp=CAU
Agitator, Device for mixing and agitating fermentation solutions.,https://image.made-in-china.com/202f0j00hKjtulPBHVfq/Fermentation-Tank-with-Agitator-Mixing-Tank-for-Beverage.jpg
Air samplers," Air samplers are used to collect and analyze air samples for microbial contamination monitoring in cleanrooms, production areas, or critical environments in bioprocessing. They help ensure air quality and prevent contamination risks.",https://www.il-biosystems.com/fileadmin/_processed_/9/2/csm_19-Spin-air-01-IUL_188afb9283.png
Airlock, Device to release gases while preventing oxygen and contaminants.,https://encrypted-tbn0.gstatic.com/images?q=tbn:ANd9GcQ2jvPlG380td1xgkBu5tNCGfKA45rQ7fJBreoC5pjlwcNUTvSBNxonPkRYqGiGZhUIPAg&usqp=CAU
Airlock, Device to release gases while preventing oxygen and contaminants.,https://encrypted-tbn0.gstatic.com/images?q=tbn:ANd9GcQ2jvPlG380td1xgkBu5tNCGfKA45rQ7fJBreoC5pjlwcNUTvSBNxonPkRYqGiGZhUIPAg&usqp=CAU
Airlock, Device to release gases while preventing oxygen and contaminants.,https://encrypted-tbn0.gstatic.com/images?q=tbn:ANd9GcQ2jvPlG380td1xgkBu5tNCGfKA45rQ7fJBreoC5pjlwcNUTvSBNxonPkRYqGiGZhUIPAg&usqp=CAU
Airlock, Device to release gases while preventing oxygen and contaminants.,https://encrypted-tbn0.gstatic.com/images?q=tbn:ANd9GcQ2jvPlG380td1xgkBu5tNCGfKA45rQ7fJBreoC5pjlwcNUTvSBNxonPkRYqGiGZhUIPAg&usqp=CAU
Analytical Balance ,Precision scale for measuring and weighing fermentation samples.,https://pim-resources.coleparmer.com/category/m/analytical-balances.jpg
Analytical balanceshttps://microbenotes.com/wp-content/uploads/2022/09/Analytical-Balance-Parts.jpg," Analytical balances provide accurate and precise weighing of samples or reagents in bioprocessing. They are essential for preparing precise solutions, determining sample quantities, or conducting analytical measurements.",https://microbenotes.com/wp-content/uploads/2022/09/Analytical-Balance-Parts.jpg
Automated colony pickers,Automated colony pickers are used to pick and transfer individual microbial colonies from agar plates. They automate the process of colony isolation and facilitate high-throughput screening and strain selection.,https://microbeonline.com/wp-content/uploads/2022/06/PIXL.jpg
Automated colony picking systems," Automated colony picking systems select and transfer individual microbial colonies from agar plates to various formats, such as microplates or tubes. They streamline colony picking and increase throughput in bioprocessing.",https://www.kbiosystems.com/Files/1.361889Ultraseal_K8_main.jpg
Automated liquid chromatography systems:," Automated liquid chromatography systems automate the separation, purification, and analysis of biomolecules using liquid chromatography techniques. They improve efficiency and reproducibility in chromatographic processes.",https://vertassets.blob.core.windows.net/image/55a12955/55a12955-8ed4-474f-bc02-c9daebfc5f44/akta_process_image.jpg
Automated liquid handling systems,"Automated liquid handling systems automate liquid transfers, dispensing, and mixing steps in bioprocessing. They improve accuracy, precision, and efficiency in sample preparation, assay setup, or high-throughput screening.",https://encrypted-tbn0.gstatic.com/images?q=tbn:ANd9GcSR9EROLzBLzLROrf3pvpIuaiQCbCWyIybIr563dgaD0n7mASZv_Xs3ECEEy45LpRVMjSk&usqp=CAU
Automated liquid nitrogen systems,"Automated liquid nitrogen systems provide continuous and controlled supply of liquid nitrogen for cryopreservation, cooling, or freezing applications in bioprocessing. They are used for long-term storage of cells, tissues, or samples.",https://encrypted-tbn0.gstatic.com/images?q=tbn:ANd9GcTz6a-_IDExoaTIwom_roM51a3fCbkOrZvbtyJo4qxFZQbUocqS7QS50Dqd7Wo5Yw8M50M&usqp=CAU
Automated sample preparation systems,"Automated sample preparation systems automate sample handling, preparation, and processing steps in bioprocessing. They streamline workflows and improve efficiency in sample preparation for analysis or downstream applications.",https://www.labbulletin.com/custom/_MG_8423.jpeg
Batch Fermentation System, System for conducting fermentation in discrete batches.,https://biodifferences.com/wp-content/uploads/2021/12/Batch-Fermentation.jpg
Benchtop centrifuges,"Benchtop centrifuges are compact and versatile centrifugation systems used for sample processing and separation in bioprocessing. They are suitable for small-scale applications, such as sample preparation, cell harvesting, or clarification.",https://profilab24.com/bilder/produkte/normal/de-labor-zentrifugen-mit-vortexfunktion-hettich-tischzentrifuge-rotina-380_a3.jpg
Bioanalyzers," Bioanalyzers are automated systems that analyze and quantify biomolecules, such as nucleic acids or proteins, in bioprocessing. They utilize microfluidic technology and provide rapid and accurate analysis of samples.",https://www.selectscience.net/images/products/7189_2100-Bioanalyzer3.jpg
Biofilm reactors,"Biofilm reactors facilitate the growth and study of biofilms, which are communities of microorganisms attached to surfaces. They simulate biofilm formation in industrial processes and aid in understanding biofilm-related phenomena.",https://www.mdpi.com/microorganisms/microorganisms-08-00679/article_deploy/html/images/microorganisms-08-00679-g001.png
Biogas Digester, System for anaerobic fermentation of organic materials to produce biogas.,https://www.kriegfischer.de/fileadmin/anlagen/referenzanlagen/A-F/Dinteloord/Dinteloord_Biogasanlage.JPG
Biogas Digester, System for anaerobic fermentation of organic materials to produce biogas.,https://www.kriegfischer.de/fileadmin/anlagen/referenzanlagen/A-F/Dinteloord/Dinteloord_Biogasanlage.JPG
Bioluminescence imaging systems," Bioluminescence imaging systems capture and analyze bioluminescent signals emitted by cells or organisms. They are used for non-invasive monitoring of gene expression, cell tracking, or studying biological processes in vivo.",https://www.researchgate.net/publication/5563807/figure/fig10/AS:650036333539379@1531992147616/Bioluminescence-in-vivo-imaging-system-The-Xenogen-In-Vivo-Imaging-System-IVIS.png
Biomass sensors," Biomass sensors measure the biomass or cell density in bioprocessing. They provide real-time monitoring of cell growth, viability, or productivity and aid in process control and optimization.",https://www.bpes.co.uk/wp-content/uploads/2020/06/Standard-Futura-3.png
Bioreactor, Equipment for large-scale fermentation and cell culture.,https://www.researchgate.net/publication/315718317/figure/fig2/AS:963548331130887@1606739232678/Bioreactor-setup-for-fermentation-with-in-line-product-extraction-pertraction-The.gif
Bioremediation systems,"Bioremediation systems use microorganisms or enzymes to degrade or detoxify pollutants in environmental bioprocessing. They can be used for wastewater treatment, soil remediation, or pollutant removal in bioprocessing industries.",https://media.springernature.com/full/springer-static/image/art%3A10.1038%2Fs41467-023-37070-2/MediaObjects/41467_2023_37070_Fig1_HTML.png
Biosafety cabinets,"Biosafety cabinets provide a controlled environment for working with hazardous materials or pathogens in bioprocessing. They protect operators, samples, and the environment from potential contamination or exposure risks.",https://brindapharma.com/wp-content/uploads/2022/11/Bio-Safety-Cabinet-5.jpg
Cell counters with viability staining, Cell counters with viability staining provide automated cell counting while simultaneously assessing cell viability using fluorescent dyes. They offer a rapid and reliable method for monitoring cell cultures.,https://d2jx2rerrg6sh3.cloudfront.net/image-handler/picture/2020/4/art1-1-1.jpg
Cell culture bags, Cell culture bags are flexible containers used for large-scale cell culture or production of biomolecules. They provide a convenient and cost-effective alternative to traditional cell culture vessels.,"https://assets.fishersci.com/TFS-Assets/CCG/Corning,-Inc./product-images/FCATMT9120086.jpg-650.jpg"
Cell culture bioreactors," Cell culture bioreactors provide a controlled environment for the growth of cells in suspension or adherent cultures. They are used for large-scale production of cells, recombinant proteins, or viral vectors in bioprocessing.",https://rreyeirs.sirv.com/infors-ht/configurator/image/bioreactor_cell_culture_555x347.jpg
Cell disruption systems," Cell disruption systems are used to break open cells and release intracellular components in bioprocessing. They can employ methods such as high-pressure homogenization, ultrasonication, or bead milling.",https://encrypted-tbn0.gstatic.com/images?q=tbn:ANd9GcRmH9GJ-A-gR2mMTcz5oB8TD4-H8PXpuz6o-Wo8ZrR-5ph_a5JPWezEEF8-LOEs6WUzXvM&usqp=CAU
Centrifuge ,Equipment for separating solid and liquid phases in fermentation products.,https://houstondynamic.com/wp-content/uploads/2022/08/Centrifuge-960x750.jpg
Chromatography columns and resins," Chromatography columns and resins are used for biomolecule purification and separation in bioprocessing. They provide the stationary phase for chromatographic separation based on affinity, size, or charge.",https://www.sigmaaldrich.com/deepweb/assets/sigmaaldrich/marketing/global/images/categories/pharma-and-biopharma-manufacturing/mobius-multi-column-capture-system/mobius-multi-column-capture-system.jpg
Chromatography systems,"Chromatography systems separate and purify biomolecules based on their physicochemical properties. They include techniques such as liquid chromatography (LC), gas chromatography (GC), or affinity chromatography for biomolecule purification.",https://www.sigmaaldrich.com/deepweb/assets/sigmaaldrich/marketing/global/images/categories/pharma-and-biopharma-manufacturing/mobius-chrom-20-system-flexibility/mobius-chrom-20-system-flexibility.jpg
Colony counters,"Colony counters automate the counting and enumeration of microbial colonies on agar plates. They provide accurate and efficient colony counting for microbial identification, antibiotic susceptibility testing, and quality control.",https://encrypted-tbn0.gstatic.com/images?q=tbn:ANd9GcRrOdss3V4oBsIjJ49WihegjZZxfyBd90mx9uwMFKe7NEknKfT8I-blgwDQnnyeqkVNYB0&usqp=CAU
Colony imaging systems," Colony imaging systems capture images of microbial colonies for analysis, counting, or characterization. They automate the colony imaging process and facilitate high-throughput screening and colony phenotyping in bioprocessing.",https://journals.sagepub.com/cms/10.1177/2211068216676587/asset/images/large/10.1177_2211068216676587-fig1.jpeg
Colony PCR systems, Colony PCR systems combine colony picking and PCR amplification in a single automated process. They enable the rapid screening and identification of recombinant clones or mutants in bioprocessing.,https://www.researchgate.net/publication/259539047/figure/fig1/AS:297227391127552@1447875940127/Schematic-illustration-of-the-single-tube-colony-PCR-for-microalgae-1-Algal-cells-were.png
Continuous bioprocessing systems,"Continuous bioprocessing systems allow continuous operation of bioprocesses, eliminating the need for batch processing. They offer increased productivity, reduced processing time, and improved process control.",https://www.genengnews.com/wp-content/uploads/2021/04/GEN40_Bioprocessing_Genentech_ManufacturingVacaville--scaled-e1619466350156.jpg
Continuous Fermentation System,System for conducting fermentation continuously without interruption.,https://www.brewer-world.com/wp-content/uploads/2019/04/Krones-Dynamic-Fermentation.jpg
Continuous flow centrifuges,Continuous flow centrifuges separate particles or cells from liquid suspensions in a continuous manner. They are used in large-scale bioprocessing for continuous cell separation or cell harvesting.,https://bioprocessintl.com/wp-content/uploads/2018/04/Centrifuge-Clarifier-Separator-FSI-_tcm11-23696.jpg
Cooling System ,System for maintaining low temperatures during fermentation.,https://northslopechillers.com/wp-content/uploads/2019/07/shutterstock_441765124-resized-01.jpg
Cryopreservation equipment,"Cryopreservation equipment includes programmable freezers, cryogenic storage tanks, and cryoprotective agents used for the long-term storage of cells, tissues, or biological samples at ultra-low temperatures.",https://www.labbulletin.com/custom/optimised%20GMP%20grade%20cryopreservation.jpg
Differential scanning calorimeters (DSC),"DSC instruments measure the thermal stability and transitions of biomolecules in bioprocessing. They provide information about protein folding, aggregation, and stability under different temperature conditions.",https://encrypted-tbn0.gstatic.com/images?q=tbn:ANd9GcSG3wGNgO2edCspFVN0_fFYsLt93BTRjuP_Z3zk5FjD346bZ7bRYwFqs2AyMmZ0IJLtjGE&usqp=CAU
Dissolution testing systems, Dissolution testing systems evaluate the release rate of active pharmaceutical ingredients from solid dosage forms. They ensure the quality and performance of oral solid dosage forms in bioprocessing.,https://www.sotax.com/fileadmin/user_upload/2021-08-04%20SOTAX%20Bilder/1%20Dissolution/USP%204/SOTAX_Dissolution_USP4_CE7smart_AR52-41.jpg
Dissolved Oxygen Probe,Sensor for measuring and monitoring the dissolved oxygen levels in fermentation vessels.,https://assets-sensors.hamiltoncompany.com/Images-Category-Group/_thumbnail/Polarographic_DO_Main.jpg?v=1677086542
DNA sequencers," DNA sequencers analyze the nucleotide sequence of DNA samples, enabling genetic analysis, sequencing of genomes, and identification of genetic variations or mutations in bioprocessing.",https://upload.wikimedia.org/wikipedia/commons/8/88/DNA-Sequencers_from_Flickr_57080968.jpg
Electroporation systems," Electroporation systems apply electric pulses to cells or tissues, creating temporary pores in their membranes for the introduction of nucleic acids or other molecules. They are widely used for genetic transformation and gene delivery in bioprocessing.",https://bioprocessintl.com/wp-content/uploads/2021/03/precigen-ultraporator.jpg
Evaporators,"Evaporators remove solvents or liquid components from samples or solutions by evaporation. They are used for sample concentration, solvent removal, or preparation of concentrated samples in bioprocessing.",https://upload.wikimedia.org/wikipedia/commons/1/15/Evaporator.jpg
Fermentation Air Compressor,Compressor for supplying compressed air to fermentation systems.,https://www.thecompressedairblog.com/hubfs/Air%20Compressor%20Set-Up.png
Fermentation Air Filtration Unit, Unit for filtering and purifying air supplied to fermentation systems.,https://image.made-in-china.com/202f0j00hdFluyzJiobO/Aseptic-Air-Filtration-System-for-Fermentation.webp
Fermentation Air Filtration Unit,Unit for filtering and purifying air supplied to fermentation systems.,https://image.made-in-china.com/202f0j00hdFluyzJiobO/Aseptic-Air-Filtration-System-for-Fermentation.webp
Fermentation Air Pump, A small pump used in some fermentation setups to control airflow and create an anaerobic environment.,https://image.made-in-china.com/2f0j00cYObGlDRhwog/Air-Operated-Wastewater-From-Fermentation-Industry-Diaphragm-Pump.webp
Fermentation Air Pump, A small pump used in some fermentation setups to control airflow and create an anaerobic environment.,https://image.made-in-china.com/2f0j00cYObGlDRhwog/Air-Operated-Wastewater-From-Fermentation-Industry-Diaphragm-Pump.webp
Fermentation Autoclavable Bag,Bag for sterile and aseptic fermentation of liquid and solid materials.,https://www.glbrc.org/sites/default/files/educational-materials/Ferm-in-Bag_0.png
Fermentation Autoclavable Bag,Bag for sterile and aseptic fermentation of liquid and solid materials.,https://www.glbrc.org/sites/default/files/educational-materials/Ferm-in-Bag_0.png
Fermentation Autoclavable Bag,Bag for sterile and aseptic fermentation of liquid and solid materials.,https://www.glbrc.org/sites/default/files/educational-materials/Ferm-in-Bag_0.png
Fermentation Biomass Dryer,Equipment for drying and processing fermented biomass.,https://encrypted-tbn0.gstatic.com/images?q=tbn:ANd9GcTzjB37VZR2Io77s9zhEJ1uRrdcBKvT15I2lQ&usqp=CAU
Fermentation Crock,A container for fermenting vegetables and sauerkraut.,https://i.pinimg.com/736x/74/b2/63/74b263beb258347f1e866b8c4ccd1852--fermentation-crock-canning.jpg
Fermentation Cryostat, Device for maintaining low temperatures in fermentation experiments.,https://www.amazonfilters.com/hubfs/amz01/Pages/Industry/Fermentation/optimise-fermentation-without-the-cost.jpg
Fermentation Foam Probe,Probe for detecting and controlling foam formation during fermentation.,https://www.drexelbrook.com/-/media/ametekdrexelbrook/articles/foam-level-in-bioreactor-vessels_599x214.jpg?la=en&revision=e7a5e90c-a993-4179-bd3c-5e0a541dc35a&hash=8BF8F078794EC77CCB13DCBDA7F66A77
Fermentation Gas Analyzer, Instrument for analyzing gas compositions and concentrations in fermentation systems.,https://encrypted-tbn0.gstatic.com/images?q=tbn:ANd9GcTNz2qOYt-DEG4awcY8vmxHSlQC0xQY_61DVkjbEPMCfQ_YG1K-
Fermentation Heat Exchanger Coil, Coil for transferring heat between fermentation media and a heat source.,https://encrypted-tbn0.gstatic.com/images?q=tbn:ANd9GcQOJ5KyEJo_gFvY2Y070RLJsVRDnPRcM5dbsjPM72LJbGz7puZpMMYaJvAlUkJy8qqMku4&usqp=CAU
Fermentation Heat Recovery Boiler,Boiler for recovering and utilizing waste heat generated during fermentation.,https://encrypted-tbn0.gstatic.com/images?q=tbn:ANd9GcS0kjOEuUnZWRqaETIHaY5jdQJ1J8ncHTKpCXzHvj2hDOnLKNXWHnsBvQ-58Me4Ni0ocAM&usqp=CAU
Fermentation Jar, Container with airtight seal for fermenting various foods.,https://m.media-amazon.com/images/I/71r17da8I3S.jpg
Fermentation Jar, Container with airtight seal for fermenting various foods.,https://m.media-amazon.com/images/I/71r17da8I3S.jpg
Fermentation Microfiltration Unit, Unit for filtering and clarifying fermentation liquids using microfiltration membranes.,https://meckey.com/upload/technology/20220523/007c84d801ffc2c71282ab6f32812139.png
Fermentation Microfiltration Unit, Unit for filtering and clarifying fermentation liquids using microfiltration membranes.,https://meckey.com/upload/technology/20220523/007c84d801ffc2c71282ab6f32812139.png
Fermentation Microfiltration Unit, Unit for filtering and clarifying fermentation liquids using microfiltration membranes.,https://meckey.com/upload/technology/20220523/007c84d801ffc2c71282ab6f32812139.png
Fermentation Process Automation System,System for automating and controlling fermentation processes.,https://encrypted-tbn0.gstatic.com/images?q=tbn:ANd9GcQO4CmTDVSB3z0WSTzE1mpo8H_tINxBMiC4zkDSaH-2YjWPnVOh
Fermentation Rotary Evaporator,Instrument for evaporating solvents from fermented solutions.,https://image.made-in-china.com/202f0j00euDkqEOJELcV/Chemical-Pharmaceutical-Single-Layer-Steam-Heating-Fermentation-Agitated-Glass-Reactor.webp
Fermentation Seed Tank,Tank for propagating and expanding starter cultures in preparation for large-scale fermentation.,https://5.imimg.com/data5/UJ/GH/MY-45303142/seed-fermenter-500x500.jpg
FERMENTATION TOOLS ,DISCRIPTION,IMAGE LOCATION
Fermentation Tray Dryer,Equipment for drying and processing fermented solids.,https://cpimg.tistatic.com/07892041/b/4/Tray-Dryer.jpg
Fermentation Ultrasonic Processor, Instrument for disrupting and lysing cells in fermentation.,https://encrypted-tbn1.gstatic.com/images?q=tbn:ANd9GcQPOmUl7xGYvpDCIpkIig1h6U7ESCbLnkIer4xShnWPYEouQ1IH
Fermentation Vessel,Container for industrial-scale fermentation processes.,https://www.emersonautomationexperts.com/wp-content/uploads/2021/01/valve-ports-fermentation-process.png
Fermentor controllers," Fermentor controllers monitor and regulate various parameters in bioreactors, such as temperature, pH, dissolved oxygen, and agitation speed. They enable precise control of the fermentation process for optimal cell growth and product formation.",https://media.licdn.com/dms/image/C5612AQFS1iC15M9Jpg/article-inline_image-shrink_1000_1488/0/1620465715350?e=1693440000&v=beta&t=J0D5tl8LBXVlgX0t8hTvdkBIgzyoCKQy9MMvC35fPVE
Filtration Membrane,Thin membrane used for separating particles in fermentation liquids.,https://meckey.com/upload/technology/20220523/007c84d801ffc2c71282ab6f32812139.png
Filtration Unit,Device for filtering solids or impurities from fermented liquids.,https://www.hongtekfiltration.com/fckeditor/php/upload/image/20210824/1629815898207809.jpg
Flow cytometry sorters, Flow cytometry sorters not only analyze but also sort cells or particles based on their characteristics. They enable the isolation of specific cell populations for downstream analysis or culture in bioprocessing.,https://research.pasteur.fr/wp-content/uploads/2018/03/research_pasteur-symphony-a5-cytometer-facsymphony-a5.jpg
Flow-through cell culture systems,"Flow-through cell culture systems provide continuous flow of media over adherent cells in bioprocessing. They mimic physiological conditions, enable long-term cell culture, and find applications in tissue engineering or drug screening.",https://www.researchgate.net/publication/233726652/figure/fig2/AS:708509981241345@1545933351769/A-A-schematic-representation-of-a-flow-chamber-including-a-toric-gasket-The-silanized.png
Flow-through dialysis systems,"Flow-through dialysis systems remove small molecules, salts, or buffer components from samples by continuous dialysis in bioprocessing. They are used for buffer exchange, sample desalting, or purification.",https://www.researchgate.net/publication/331368540/figure/fig1/AS:760662858940417@1558367566888/Bioreactor-design-The-flow-goes-through-the-apical-chamber-blue-arrows-where-the-cell.png
Fluorescence microscopes,"Fluorescence microscopes visualize and analyze fluorescently labeled samples in bioprocessing. They enable the observation of cellular structures, protein localization, or dynamic processes in living cells.",https://microbiologynote.com/wp-content/uploads/2020/07/fluoroscent-microscope.jpg
Foam Control Agent,Chemical additive to prevent excessive foaming in fermenters.,https://fluidhandlingpro.com/wp-content/uploads/2018/01/Foam-Control_Related-1.jpg
Gas Analyzer,Instrument for analyzing and monitoring gas compositions in fermentation.,https://www.hidenanalytical.com/wp-content/uploads/2020/05/Fermentation-1024x683.jpg
Gas analyzers for dissolved gases,"Gas analyzers designed for dissolved gases measure the concentration of dissolved oxygen, carbon dioxide, or other gases in liquid samples. They are used for monitoring dissolved gas levels in bioprocessing.",https://www.srigc.com/cn/content/32/large/1372421469.jpg
Gas Chromatography System,Analytical instrument for separating and analyzing volatile compounds in fermentation products.,https://d2jx2rerrg6sh3.cloudfront.net/image-handler/picture/2020/10/shutterstock_51050179.jpg
Gas Chromatography System,Analytical instrument for separating and analyzing volatile compounds in fermentation products.,https://d2jx2rerrg6sh3.cloudfront.net/image-handler/picture/2020/10/shutterstock_51050179.jpg
Gas chromatography-mass spectrometry (GC-MS) systems," GC-MS systems combine gas chromatography with mass spectrometry detection for the analysis of volatile compounds in bioprocessing. They are used for metabolite profiling, environmental monitoring, and aroma analysis.",https://upload.wikimedia.org/wikipedia/commons/4/47/GCMS_closed.jpg
Gas Scrubber, Equipment for removing impurities from gas streams generated in fermentation.,https://5.imimg.com/data5/SELLER/Default/2023/3/295048071/NB/HQ/IZ/37030424/industrial-gas-scrubber-500x500.jpeg
Gel documentation systems," Gel documentation systems are used to capture and analyze images of gels or blots in bioprocessing. They enable visualization and quantification of nucleic acids, proteins, or other molecules separated by electrophoresis.","https://static.wixstatic.com/media/3f342e_bc1b7470d0cf42fc8523e15b2b23d32c~mv2.jpg/v1/fit/w_500,h_500,q_90/file.jpg"
Gel electrophoresis systems," Gel electrophoresis systems separate biomolecules, such as nucleic acids or proteins, based on their size and charge. They are used for DNA or protein analysis, DNA fragment sizing, and purification of DNA or RNA samples.",https://cdn.globalso.com/gelepchina/sdc.jpg
Gene synthesis instruments," Gene synthesis instruments enable the rapid and accurate synthesis of DNA sequences. They are used for gene cloning, protein engineering, and synthetic biology applications in bioprocessing.",https://encrypted-tbn0.gstatic.com/images?q=tbn:ANd9GcTVFEqpH74vZrIgBYewQM8H9UvmfYZ0KftghU_yS6_2y9iOEiOtDLZQV0Q5EPVlZvc7cLk&usqp=CAU
