Tool_name,Description,Location
Solvent precipitation,"In this method, the solvent conditions are altered to induce precipitation. Organic solvents such as ethanol or acetone are commonly used. By adding these solvents to the solution, the polarity and composition of the solvent are changed, leading to a decrease in the solubility of the biomolecules. As a result, the biomolecules undergo precipitation and can be separated from the solvent. Care should be taken to optimize the solvent concentration and conditions to maximize precipitation efficiency while minimizing potential denaturation or damage to the biomolecules.",https://ars.els-cdn.com/content/image/1-s2.0-S0065242319301052-f03-01-9780128211670.jpg 
Spray drying,"Spray drying is a rapid drying technique that involves atomizing a liquid or slurry into small droplets, which are then dried in a hot airstream. The droplets quickly lose moisture, resulting in the formation of dry particles. Spray drying is widely used in the food, pharmaceutical, and chemical industries to produce powders, granules, and microencapsulated products. It is suitable for heat-sensitive materials and enables the production of free-flowing powders with controlled particle size and morphology.",https://www.freund-vector.com/wp-content/uploads/2021/03/Spray-Drying-Diagram_Open-Loop-VSD200-1-1024x613.png 
Sterile Filtration,"Sterile filtration is a critical application in bioprocessing to remove microorganisms and ensure the sterility of the final product. Membrane filters with pore sizes of 0.2 ?m or smaller are commonly used for sterile filtration. Sterile filtration can be applied to both liquids and gases, preventing microbial contamination during downstream processing or packaging.",https://www.researchgate.net/publication/350618772/figure/fig1/AS:1009463242797056@1617686200185/Schematic-representation-of-the-sterile-filtration-method-Contaminating-agents-such-as.ppm  
Tangential Flow Filtration (TFF),"Tangential flow filtration, also known as crossflow filtration, is a technique that allows continuous separation and concentration of particles and solutes. TFF utilizes a porous membrane through which the feed solution flows tangentially, creating a crossflow that sweeps away retained particles from the membrane surface. The retained particles concentrate on the membrane surface while the permeate, containing smaller molecules, passes through the membrane. TFF is particularly useful for concentration and purification of large volumes of solutions while minimizing membrane fouling.",https://i0.wp.com/www.rocker.com.tw/wp-content/uploads/2022/11/%E5%AE%98%E7%B6%B2%E6%87%89%E7%94%A8%E5%9C%96%E7%A4%BA-TFF_01_En.jpg 
Ultracentrifugation,"Ultracentrifugation is a technique that involves high-speed centrifugation to achieve the separation of particles or components based on their size, shape, and density. Ultracentrifuges operate at very high speeds, typically in the range of 50,000 to 150,000 revolutions per minute (rpm). There are two main types of ultracentrifugation: 1. Analytical Ultracentrifugation (AUC): AUC is used to analyze the sedimentation behavior of particles in a sample, providing information about their size, shape, and molecular weight. 2. Preparative Ultracentrifugation: Preparative ultracentrifugation is employed for large-scale separation and purification of biological components, such as proteins, subcellular organelles, or viruses. Ultracentrifugation can generate very high centrifugal forces, allowing the separation of particles with small density differences.",https://www.mun.ca/biology/scarr/Analytical_ultracentrifugation.jpg 
Vaccum drying,"Vacuum drying involves applying reduced pressure to facilitate moisture removal. By reducing the pressure, the boiling point of water is lowered, allowing it to evaporate at lower temperatures. Vacuum drying helps to minimize heat exposure, making it suitable for heat-sensitive materials. It is commonly used in pharmaceutical and food industries for preserving the quality of sensitive products.",https://www.satovac.co.jp/en/img/seminar/semi_zu03.gif 
