Tool_name,Description,Location
Granulation Machine,Equipment for granulating and pelletizing fermented materials.,https://encrypted-tbn0.gstatic.com/images?q=tbn:ANd9GcQKO73SzlQb3xy_PYX9eJcq6LiIdQT2eXufqIgOaPqxGUyqLfCZu0V-Nd3ac5xLyXD6lcE&usqp=CAU
Harvesting System, Machinery for separating and collecting fermented biomass or products.,https://encrypted-tbn0.gstatic.com/images?q=tbn:ANd9GcRyFHKXgosR2IKuAmIsT_V9GLJAPYHVHGpn3_umSMVbZ4PbIbvVeyvzvUykG4BBGMcOcVM&usqp=CAU
Harvesting Tank,Tank for collecting and storing harvested fermentation products.,https://img.directindustry.com/images_di/photo-g/107197-14410673.jpg
Heat Exchanger, Device for controlling temperature by exchanging heat between process fluids.,https://www.barriquand.com/wp-content/uploads/2021/01/img_barriquand_multistream_platular_heat_exchanger.jpg
Heat Recovery System,System for capturing and utilizing waste heat generated during fermentation.,https://encrypted-tbn0.gstatic.com/images?q=tbn:ANd9GcSn4l5HsTnOkTMkSa-owGAvK88RN0XzEj7vwpR95NN0iOU9znmhlUtk-2R_ScCiAKvAZj0&usqp=CAU
Heat Shrink Tunnel,Equipment for applying heat shrinkable film to fermentation products.,https://upload.wikimedia.org/wikipedia/commons/thumb/1/18/SSF_Costco_bakery_pastry_packaging_line.JPG/1200px-SSF_Costco_bakery_pastry_packaging_line.JPG
High-Pressure Fermentation System, System for conducting fermentation under high-pressure conditions.,https://image.made-in-china.com/202f0j00bdcaAMkqkTpw/High-Pressure-Fermentater-Reactor-for-Pharmaceutical-Fermentation.webp
High-speed centrifuges,"High-speed centrifuges are used for the rapid separation of biomolecules or particles based on their density. They are capable of achieving high g-forces, enabling efficient separation in a short period.",https://encrypted-tbn0.gstatic.com/images?q=tbn:ANd9GcTPZx3c7ZLR_FlmDQqfM1qqCg7azhQ1yu4e5f9YiReYbLhAbbVCMGXBYyQC0cpPD8azEyI&usqp=CAU
Homogeneous assay systems," Homogeneous assay systems provide a simple and rapid method for analyzing biomolecular interactions and enzymatic activities in bioprocessing. They eliminate the need for separation steps, making them suitable for high-throughput screening.",https://www.researchgate.net/publication/332320259/figure/fig5/AS:746066651648008@1554887559967/Simplified-mechanisms-of-heterogeneous-left-and-homogeneous-assay-principles-using.jpg
Homogenizer,Instrument for breaking down and emulsifying fermented materials.,https://image.made-in-china.com/2f0j00cozgueDFhLbH/Homogenizer-Tank-Homogeniser-Tank-Emulsifying-Tank-Detergent-Tank-Fermentation-Tank.jpg
Homogenizers," Homogenizers disrupt or break down samples to achieve uniform particle size, dispersion, or emulsification in bioprocessing. They are used for sample preparation, cell lysis, or emulsion formation.",https://microbeonline.com/wp-content/uploads/2022/09/Homogenizers.png
HPLC systems," High-performance liquid chromatography (HPLC) systems separate and analyze biomolecules based on their interactions with a stationary phase and mobile phase. They are widely used for biomolecule purification, analysis, and quality control.",https://encrypted-tbn0.gstatic.com/images?q=tbn:ANd9GcSkI4RDfoeFsjNandDqmXcKms2yWfPV6MYOC-itkk98yOD8PBeoRzACZL0cgFcTd0C8iKU&usqp=CAU
Hydrogenation systems, Hydrogenation systems facilitate hydrogenation reactions for the synthesis or modification of compounds in bioprocessing. They provide controlled hydrogenation conditions and are used in chemical or pharmaceutical industries.,https://i.ytimg.com/vi/dikZqt3GDYw/maxresdefault.jpg
Imaging flow cytometers,"Imaging flow cytometers combine the capabilities of traditional flow cytometry with imaging technology. They enable the analysis and imaging of individual cells, providing detailed information about cell morphology, fluorescence, and cellular events.",https://www.mdpi.com/ijms/ijms-21-02323/article_deploy/html/images/ijms-21-02323-g001.png
Immunoassay kits, Immunoassay kits are used for the detection and quantification of specific proteins or biomarkers in bioprocessing. They utilize antigen-antibody interactions for sensitive and selective analysis.,https://www.enzolifesciences.com/fileadmin/redacteur/bilder/Platforms/Immunoassay_and_Assay_Development/Immunoassay_kits/2013-08-Header-Immunoassay-Kits.png
Incubators,"Incubators provide a controlled environment for cell culture, microbial fermentation, or the growth of microorganisms in bioprocessing. They maintain optimal temperature, humidity, and gas conditions to support cell growth and product formation.",https://www.scimetricsinc.com/images/detailed/2/H3501-feature-diagram2.gif
Industrial Fermentation Biorefinery, Integrated facility for large-scale fermentation and downstream processing.,https://i.ytimg.com/vi/xDxCk2lfn3U/maxresdefault.jpg
Industrial Fermentation Microscope,Microscope for visual inspection of fermentation processes at an industrial scale.,https://3.imimg.com/data3/OR/IA/MY-9785549/fermentation-equipments-500x500.jpg
Inline Mixer ,Device for mixing and blending ingredients in a continuous fermentation process.,https://image.made-in-china.com/202f0j00TZNEdKURZObf/Water-and-Powder-Mixing-Pump-high-shear-inline-mixer-.webp
Inoculation Needle, Tool for introducing inoculum into fermentation vessels.,https://pim-resources.coleparmer.com/product/l/inoculating-needle-and-loops-2984.jpg
Ion Exchange Column,Column for removing or exchanging ions in fermentation solutions.,https://encrypted-tbn0.gstatic.com/images?q=tbn:ANd9GcT6ymNUT-rlU9JX_sCI8o2345uKnQa8yD7FambVnY4i4ttbwpwABXTaZGuqHeCv8HlerEs&usqp=CAU
Ion Exchange Column,Column for removing or exchanging ions in fermentation solutions.,https://encrypted-tbn0.gstatic.com/images?q=tbn:ANd9GcT6ymNUT-rlU9JX_sCI8o2345uKnQa8yD7FambVnY4i4ttbwpwABXTaZGuqHeCv8HlerEs&usqp=CAU
Liquid Chromatography-Mass Spectrometry System, Integrated system for separating and analyzing compounds in fermentation products.,https://www.nebiolab.com/wp-content/uploads/2019/10/lcms-card.webp
Liquid Dispenser,Device for accurately dispensing liquids into fermentation vessels.,https://bioevopeak.com/wp-content/uploads/2021/06/Laboratory-Use-Liquid-Dispenser-Bottle-Top-Dispenser-03-500x500.jpg
Liquid Level Sensor,Sensor for monitoring and controlling liquid levels in fermentation vessels.,https://www.sapconinstruments.com/files/Fermentation-Tank-Level-Sensor-Applications-in-Brewery-Industry.webp
Liquid Nitrogen Dewar ,Container for storing and transporting liquid nitrogen used in fermentation.,https://image.made-in-china.com/44f3j00qGkVvmAMEEpP/Bulk-Liquid-Nitrogen-Dewar-Price-of-Cryogenic-Tank.webp
Liquid Sampler,Device for collecting representative samples from fermentation vessels.,https://encrypted-tbn0.gstatic.com/images?q=tbn:ANd9GcSC72e2Z4JehOe5iCjn49hCGWqxSEVUC_pXShkQm_pH1bA0HvV8z7P13qWuCCgTzb3RV20&usqp=CAU
Liquid Storage Tank,Tank for storing fermented liquids before further processing or packaging.,https://image.made-in-china.com/2f0j00BQjGpTNMEmcv/Large-Beer-Fermenter-Tank-for-Industrial-Fermentation-Process.webp
Lyophilization systems," Lyophilization systems, also known as freeze-drying systems, are used to remove water from sensitive materials while preserving their structure and activity. They are commonly used for the drying of pharmaceuticals, vaccines, and biologics.",https://image2.slideserve.com/4523095/lyophilizer-units-l.jpg
Magnetic Stirrer, Instrument for stirring and mixing fermentation solutions using a magnetic field.,https://image.made-in-china.com/202f0j00asCEMgOyLjrS/Magnetic-Stirring-Fermentation-Tank-for-Vaccine.jpg
Mass Spectrometer,Analytical instrument for identifying and quantifying compounds in fermentation products.,https://encrypted-tbn0.gstatic.com/images?q=tbn:ANd9GcRqPVrXqsHZjFd6Le4155TOBipjtw1RokBxY_HMOb7TQTxCys23hT5qH_80KeY2J88FjvI&usqp=CAU
Mass Spectrometer,Analytical instrument for identifying and quantifying compounds in fermentation products.,https://encrypted-tbn0.gstatic.com/images?q=tbn:ANd9GcRqPVrXqsHZjFd6Le4155TOBipjtw1RokBxY_HMOb7TQTxCys23hT5qH_80KeY2J88FjvI&usqp=CAU
Membrane Bioreactor ,Bioreactor that combines membrane filtration and fermentation processes.,https://www.thembrsite.com/imager/teaserimages/80824/MBR-JJ-iMBR-scheme-2-b24cd2d6db.png
Microarray printers," Microarray printers precisely deposit samples or biomolecules onto microarray slides or chips. They are used in DNA microarray analysis, protein microarrays, or high-throughput screening applications.",https://www.researchgate.net/publication/259959772/figure/fig1/AS:213988345421825@1428030205163/a-A-robotic-microarray-spotter-was-used-to-rapidly-print-droplets-consisting-of-hMSCs.png
Microarray scanners," Microarray scanners detect and analyze the fluorescence or chemiluminescence signals generated from microarrays. They are commonly used in gene expression analysis, mutation detection, and protein profiling.",https://media.biocompare.com/m/37/images/innoscan-710-ir--710-ir-al-microarray-scanner-1050935-400x300.jpg?ts=638224435653198620
Microbial detection systems,"Microbial detection systems detect and quantify microorganisms in bioprocessing samples or environments. They use various techniques, such as PCR, immunoassays, or biosensors, for rapid and sensitive microbial detection.",https://www.sigmaaldrich.com/deepweb/assets/sigmaaldrich/marketing/global/images/technical-documents/articles/microbiological-testing/bioburden-testing/ez-fluo-system-camera-beside/ez-fluo-system-camera-beside.jpg
Microbial fermentation monitoring systems,"Microbial fermentation monitoring systems provide real-time monitoring of key parameters such as biomass, dissolved oxygen, pH, and substrate concentration during microbial fermentation processes.",https://www.genengnews.com/wp-content/uploads/2019/05/May9_2019_Getty_545879619_ManInLabWithFermenter.jpg
Microbial identification systems," Microbial identification systems identify and classify microorganisms based on their genetic or phenotypic characteristics. They aid in microbial identification, species confirmation, and taxonomy in bioprocessing.",https://encrypted-tbn0.gstatic.com/images?q=tbn:ANd9GcT4q4hpxO2y2q9Qiyyv3FQpY2fNXF4gIDeicXK0F4_KLF-GB0MUqZyejfFdQ3XhLb7xQos&usqp=CAU
Microbioreactors,"Microbioreactors miniaturize bioreactors, enabling parallel processing of multiple small-scale cultures. They are used for high-throughput screening, process optimization, or rapid process development in bioprocessing.",https://encrypted-tbn0.gstatic.com/images?q=tbn:ANd9GcRaCgmEeSmdP9kds0vtYkmybEmUDQjokxrD5-VEFah6M1SvWXFobFRolc5oHbbp9hfxi6M&usqp=CAU
Microencapsulation systems,"Microencapsulation systems encapsulate active ingredients or cells within small particles or capsules. They protect sensitive materials, enable controlled release, and find applications in drug delivery or cell therapy in bioprocessing.",https://pub.mdpi-res.com/processes/processes-08-00889/article_deploy/html/images/processes-08-00889-ag.png?1595836705
Microfluidic devices," Microfluidic devices manipulate small volumes of fluids in microscopic channels and chambers. They enable precise control of fluid flow, mixing, and reaction conditions, and find applications in lab-on-a-chip systems and microscale bioprocessing.",https://pub.mdpi-res.com/micromachines/micromachines-09-00394/article_deploy/html/images/micromachines-09-00394-g006-550.jpg?1570350308
Microplate washers ,"Microplate washers automate the washing steps in microplate-based assays. They remove unbound substances or reagents from wells, ensuring accurate and reproducible results.",https://cdn.shopify.com/s/files/1/1665/2193/collections/405verify_magnified.jpg?v=1483400220
Moisture analyzers ,"Moisture analyzers determine the moisture content of samples or materials in bioprocessing. They find applications in moisture analysis, drying processes, or moisture control in pharmaceutical or food industries.",https://www.sartorius.com/shop/medias/?context=bWFzdGVyfHJvb3R8MzE0NzV8aW1hZ2UvanBlZ3xoNDgvaDNhLzkxOTI0MjYxMTEwMDYuanBnfGUzZTk2N2U1OTgzZTQ0ZWM3NDc1ZmMzYWZjYTgwMzQ0ZWY2OTUyYjYwMjdiMTBmYjIwNmViMDcwMmI1ZGJkYTI
Multi-omics analysis platforms,"Multi-omics analysis platforms integrate multiple ""-omics"" technologies, such as genomics, transcriptomics, proteomics, and metabolomics, to provide a comprehensive view of biological systems in bioprocessing.",https://www.labbulletin.com/custom/connected-analytics-product-web-graphic.jpg
Multi-Stage Fermentor,Fermentation system with multiple stages for complex processes.,https://image.made-in-china.com/202f0j00YQtbNUEyRpkG/Computer-Controlled-Biological-Fermentation-Laboratory-System-Multi-Stage-Independent-Sterilization-Stainless-Steel-Fermenter-Equipment.webp
Nitrogen Blanket System, System for covering fermentation vessels with a layer of nitrogen gas to prevent oxidation.,https://encrypted-tbn0.gstatic.com/images?q=tbn:ANd9GcSjBKHF0WVNS38He9Pca23h10XLXPyiAezWXahKVl_tzp3vtCs4kIR5uE1j6hBpuO3d5BM&usqp=CAU
Nitrogen Blanket System, System for covering fermentation vessels with a layer of nitrogen gas to prevent oxidation.,https://encrypted-tbn0.gstatic.com/images?q=tbn:ANd9GcSjBKHF0WVNS38He9Pca23h10XLXPyiAezWXahKVl_tzp3vtCs4kIR5uE1j6hBpuO3d5BM&usqp=CAU
Nucleic acid extraction systems,"Nucleic acid extraction systems isolate and purify DNA or RNA from various samples in bioprocessing. They utilize methods such as column-based purification, magnetic bead-based extraction, or solid-phase extraction.",https://encrypted-tbn0.gstatic.com/images?q=tbn:ANd9GcRLcU9PPZBgBwVHZ9uDLxlPbyDjECkLlLe8mEfc9ldpNCbD3_62KBNaCuzo0eO2k8DVWiw&usqp=CAU
Nutrient analyzers,"Nutrient analyzers measure the concentration of nutrients, such as sugars, amino acids, or ions, in bioprocessing media or culture supernatants. They provide real-time nutrient monitoring for process control and optimization.",https://www.genengnews.com/wp-content/uploads/2018/10/Flownamics_Fig11861501257.jpg
Nutrient feeders," Nutrient feeders provide controlled and automated feeding of nutrients or additives into bioreactors or culture vessels. They ensure optimal nutrient supply for cell growth, productivity, and process stability.",https://pub.mdpi-res.com/fishes/fishes-06-00074/article_deploy/html/images/fishes-06-00074-g004.png?1639022482
Oxygen Analyzer, Instrument for measuring oxygen levels in fermentation vessels.,https://encrypted-tbn0.gstatic.com/images?q=tbn:ANd9GcSfwoJVByBaG01wrry_bwKJg6iIBW6fHs1aKYtb1gSSMxD9LM50ZbwxQkzGCezQmnHHy_o&usqp=CAU
Oxygen Scavenger,Chemical agent for removing oxygen from fermentation systems.,https://upload.wikimedia.org/wikipedia/commons/5/52/Mitsubishi_Gas_Chemical_oxygen_absorber_Ageless_contents_20090104.jpg
Oxygen sensors,"Oxygen sensors measure the dissolved oxygen concentration in liquid samples or bioreactors. They monitor and control oxygen levels for optimal cell growth, metabolism, or fermentation in bioprocessing.",https://img.directindustry.com/images_di/photo-g/32049-13104068.webp
Particle size analyzers, Particle size analyzers measure and analyze the size distribution of particles in suspensions or emulsions. They are essential for monitoring and controlling particle size during formulation and manufacturing processes in bioprocessing.,https://cdn.labx.com/v2/images/catalog/product/69617/SCP-4905575b-084e-4a93-a4a5-83c8a58f0ce4.webp
PCR thermal cyclers,"PCR thermal cyclers provide precise temperature control for PCR amplification of DNA sequences. They enable rapid and accurate DNA amplification for applications such as gene expression analysis, genotyping, and molecular diagnostics.",https://cdn1.cleaverscientific.com/wp-content/uploads/2021/03/26024123/GTC96-1.WEB_.jpg
Perfusion systems, Perfusion systems provide continuous nutrient supply and waste removal in bioreactors by maintaining a continuous flow of fresh media. They are commonly used for long-term cell culture and production of high-value products.,https://www.researchgate.net/publication/326495079/figure/fig1/AS:661815335866371@1534800480802/Typical-steady-state-perfusion-bioreactor-setup.png
Peristaltic Pump,Pump for delivering precise volumes of fluids in fermentation processes.,https://leadfluid.com/wp-content/uploads/bioreactor.jpg
pH Controller,Device for monitoring and controlling pH levels during fermentation.,https://ars.els-cdn.com/content/image/1-s2.0-B978044464337700015X-f15-01-9780444643377.jpg
pH Electrode,Sensor for measuring and monitoring pH levels in fermentation vessels.,https://5.imimg.com/data5/SELLER/Default/2021/8/JO/EH/PY/55602588/bh1545-500x500.jpg
Pressure Relief Valve,Valve for releasing excess pressure in fermentation vessels to prevent explosions.,https://thumbs.dreamstime.com/z/pneumatic-butterfly-valve-refinery-chemical-plant-pilot-pressure-relief-86298829.jpg
Pressure Transducer,Sensor for measuring and monitoring pressure inside fermentation vessels.,https://cpimg.tistatic.com/04723040/b/6/Differential-Pressure-Transmitters.jpg
Process analytical technology (PAT) systems,"PAT systems integrate online or real-time monitoring and control of critical process parameters in bioprocessing. They enable process optimization, quality assurance, and regulatory compliance.",https://vertassets.blob.core.windows.net/image/06a49a09/06a49a09-0253-4028-8020-061b3ce29b47/sartorius_0421_pg14.png
Protein crystallization systems, Protein crystallization systems provide controlled conditions for the formation of protein crystals. They are used in structural biology to determine the three-dimensional structure of proteins using X-ray crystallography.,https://pubs.acs.org/cms/10.1021/acs.cgd.9b01446/asset/images/medium/cg9b01446_0004.gif
Real-time PCR systems ,"Real-time PCR systems monitor the amplification of DNA in real-time, allowing quantitative analysis of target genes or nucleic acids in bioprocessing. They enable gene expression profiling, pathogen detection, or genotyping.",https://assets.fishersci.com/TFS-Assets/LSG/product-images/QuantStudio-5-right-650x635.jpg-650.jpg
Rheometers," Rheometers measure the flow properties and viscoelastic behavior of fluids or materials in bioprocessing. They are used to characterize the viscosity, shear stress, and deformation of biomaterials or formulations.",https://media.americanpharmaceuticalreview.com/m/28/images/rheolabqc-rotational-rheometer-3416101-400x300.jpg?ts=638200168889092935
Robotic systems for high-throughput screening," Robotic systems automate high-throughput screening processes, including compound handling, plate preparation, and assay setup. They enable efficient screening of large compound libraries for drug discovery or biological research.",https://www.usinenouvelle.com/mediatheque/1/6/9/000173961_896x598_c.jpg
Rotary Disc Dryer ,Equipment for drying fermented solids using rotating discs.,https://encrypted-tbn0.gstatic.com/images?q=tbn:ANd9GcQ0B3_XtXfFFGyBg6k4yS3UrAv1hkKa1JSdfylcRruvTDsRXiGAruooGxw9Mq6wjSnRcEs&usqp=CAU
Rotary Drum Dryer,Equipment for drying fermented solids using rotating drums.,https://upload.wikimedia.org/wikipedia/commons/8/8f/Single_Shell_Rotary_Drum_Dryer.jpg
Rotary Drum Dryer,Equipment for drying fermented solids using rotating drums.,https://upload.wikimedia.org/wikipedia/commons/8/8f/Single_Shell_Rotary_Drum_Dryer.jpg
Rotary Drum Thickener,Equipment for thickening and dewatering fermented solids.,https://www.bdpindustries.com/wp-content/uploads/2023/04/rdt1-1r.jpg
Rotary Drum Thickener,Equipment for thickening and dewatering fermented solids.,https://www.bdpindustries.com/wp-content/uploads/2023/04/rdt1-1r.jpg
Rotovap, Rotary evaporator for removing solvents from fermented solutions under reduced pressure.,https://www.liquor.com/thmb/cndyfedi9b03PZ1Lem7mmvUen_0=/1500x0/filters:no_upscale():max_bytes(150000):strip_icc()/rotovap_Empirical-Spirits-large-scale-rotovap-credit--Time-Spreadbury_720x480-5318f5ae50c64f68b141dc8a1eb9f541.jpg
Rotovap, Rotary evaporator for removing solvents from fermented solutions under reduced pressure.,https://www.liquor.com/thmb/cndyfedi9b03PZ1Lem7mmvUen_0=/1500x0/filters:no_upscale():max_bytes(150000):strip_icc()/rotovap_Empirical-Spirits-large-scale-rotovap-credit--Time-Spreadbury_720x480-5318f5ae50c64f68b141dc8a1eb9f541.jpg
Rotovap, Rotary evaporator for removing solvents from fermented solutions under reduced pressure.,https://www.liquor.com/thmb/cndyfedi9b03PZ1Lem7mmvUen_0=/1500x0/filters:no_upscale():max_bytes(150000):strip_icc()/rotovap_Empirical-Spirits-large-scale-rotovap-credit--Time-Spreadbury_720x480-5318f5ae50c64f68b141dc8a1eb9f541.jpg
Sampling Valve,Valve for withdrawing samples from fermentation vessels for analysis.,https://www.abset.com/vamp/wp-content/uploads/2018/04/unique_sampling_valve_.png
Sieve Shaker,Device for separating and classifying solid particles in fermentation products.,https://pim-resources.coleparmer.com/category/m/laboratory-sieves-and-sieve-shakers.jpg
Solid-State Fermentation Chamber, Chamber for conducting solid-state fermentation processes.,https://encrypted-tbn0.gstatic.com/images?q=tbn:ANd9GcTrO_QO2Tr87cIfxtABz7Y_bYTzvUZZhEt9HJ3UVLqHXwcRUXNrpwjJMVfq5abxu_KfW_E&usqp=CAU
Solvent Recovery System, Equipment for recovering solvents used in fermentation processes.,https://www.globalspec.com/ImageRepository/LearnMore/20171/Solvent_extraction_plant-distillation_section7192ebf731554de7ad4955ff28f5accb.png
Solvent Recovery System, Analytical instrument for separating and analyzing components in fermentation products.,https://www.globalspec.com/ImageRepository/LearnMore/20171/Solvent_extraction_plant-distillation_section7192ebf731554de7ad4955ff28f5accb.png
Sonicators ,"Sonicators use ultrasonic waves for sample processing, dispersion, or cell lysis in bioprocessing. They are effective in breaking down cell structures, emulsification, or particle size reduction.",https://5.imimg.com/data5/SELLER/Default/2021/12/AV/EU/GQ/1666279/image-1--500x500.png
Sparging System,System for introducing gases into fermentation vessels for aeration.,https://www.shinkaifilter.com/wp-content/uploads/2020/10/Picture24.jpg
Spectrofluorometers," Spectrofluorometers measure the fluorescence emission and excitation of molecules in bioprocessing. They are used for quantitative analysis, fluorescence-based assays, or characterization of fluorescent probes.",https://cdn.labx.com/v2/images/catalog/product/4863184/b563c9f2-55e8-4f2c-87fc-0c3eeaf7a92e.webp
Spectrophotometer, Instrument for measuring light absorption and transmission in fermentation samples.,https://encrypted-tbn0.gstatic.com/images?q=tbn:ANd9GcR9mrKxAAqZlNEijx7Cj85wxTaPzmSj_M4D8xqmxGZnVbtswuHauv_rB92rB212y6D1i5U&usqp=CAU
Stability chambers," Stability chambers provide controlled temperature and humidity conditions for the stability testing of pharmaceuticals, biologics, or other sensitive materials in bioprocessing. They ensure product quality and shelf-life determination.",https://cdn.scientificproducts.com/product_images/reach-in-stability-chamber/6228feff3bc53b0068f30c4d/zoom.jpg?c=1646853887
Sterilizer,Equipment for sterilizing fermentation vessels and components.,https://bioengineering.ch/assets/Bilder/Company-Footer/3zu2/_600xAUTO_crop_center-center_75/DSC_2023-3.jpg
Surface plasmon resonance (SPR) systems,SPR systems measure the binding kinetics and affinity of biomolecular interactions in real-time. They are used for label-free analysis of molecular interactions in bioprocessing.,https://www.bioradiations.com/wp-content/uploads/2013/07/efficient-spr-based-fragment-screening-and-small-molecule-affinity-analysis-using-bio-rads-proteon-xpr36-system-feature.jpg
Temperature Controller, Equipment for maintaining precise temperature conditions during fermentation.,https://ars.els-cdn.com/content/image/1-s2.0-S2215017X19300463-gr1.jpg
Tissue culture hoods," Tissue culture hoods, also known as laminar flow hoods, provide a sterile environment for handling and manipulating cells or tissues in bioprocessing. They minimize the risk of contamination during cell culture procedures.",https://cdn.britannica.com/35/101835-004-FAE53808/Tissue-culture-laminar-flow-cabinet-working-conditions.jpg
Transfection systems,"Transfection systems facilitate the introduction of nucleic acids into cells for genetic manipulation or protein expression in bioprocessing. They can be based on chemical methods, electroporation, or viral vectors.",https://bioprocessintl.com/wp-content/uploads/2021/10/19-10-SS-Corning-P1.jpg
tubular Heat Exchange,THeat exchanger consisting of parallel tubes for efficient heat transfer in fermentation.,https://img.interempresas.net/FotosArtProductos/P100252.jpg
tubular Heat Exchange,THeat exchanger consisting of parallel tubes for efficient heat transfer in fermentation.,https://img.interempresas.net/FotosArtProductos/P100252.jpg
Ultrafiltration systems," Ultrafiltration systems separate and concentrate biomolecules or particles based on size using porous membranes. They are used for sample concentration, buffer exchange, or purification in bioprocessing.",https://www.netsolwater.com/netsol-water/assets/img/product-images/Ultra_filtration_advantages_in_Dairy_and_Beverage_Industry.jpg
Ultraviolet Sterilizer ,Device for sterilizing air or surfaces in fermentation environments.,https://www.foodnavigator.com/var/wrbm_gb_food_pharma/storage/images/1/9/1/2/922191-1-eng-GB/Ultraviolet-water-disinfection-systems-in-food-and-beverage.jpg
UV-Vis spectrophotometers,"UV-Vis spectrophotometers measure the absorption or transmission of ultraviolet and visible light by samples in bioprocessing. They are used for quantification, purity analysis, or kinetics studies of biomolecules.",https://www.thermofisher.com/TFS-Assets/MSD/product-images/GENESYS-180-8-cell-changer-840-309000.jpg-650.jpg
